{
    "model": "momCar.xml",
    "healthbarColor": "0xD8558E",
	"healthIconsModel": "icon-mom.xml",

    "alignVertical": "end",
    "alignHorizontal": "start",
    "leftFacing": false,
    "continuousIdle": true,

    "actions": {

        "sing": [
            { "direction": "left",   "anim": "Mom Left Pose",   "offsetX": -74  },
            { "direction": "down",   "anim": "MOM DOWN POSE"                    },
            { "direction": "up",     "anim": "Mom Up Pose",     "offsetX": 18   },
            { "direction": "right",  "anim": "Mom Right Pose"                   }
        ],

        "idle": { "anim": "Mom Idle" }
    }
}
