{
    "model": "bfPixel.xml",
    "healthbarColor": "0x31B3D1",
    "healthIconsModel": "icon-bf-pixel.xml",
    
	"alignVertical": "end",
    "alignHorizontal": "start",
    "leftFacing": true,

    "actions": {

        "sing": [
            { "direction": "left",   "anim": "BF LEFT NOTE instance"  },
            { "direction": "down",   "anim": "BF DOWN NOTE instance"  },
            { "direction": "up",     "anim": "BF UP NOTE instance"    },
            { "direction": "right",  "anim": "BF RIGHT MISS instance" }
        ],

        "miss": [
            { "direction": "left",   "anim": "BF LEFT MISS instance" },
            { "direction": "down",   "anim": "BF DOWN MISS instance" },
            { "direction": "up",     "anim": "BF UP MISS instance"   },
            { "direction": "right",  "anim": "BF RIGHT MISS instance" }
        ],

        "idle": { "anim": "BF IDLE instance" },
		
		"extras": [
            { "name": "dies",        "anim": "BF Dies pixel",   "animHold": "Retry Loop", 	"model": "bfPixelsDEAD.xml" },
            { "name": "retry",       "anim": "RETRY CONFIRM",   "animHold": null, 			"model": "bfPixelsDEAD.xml" },
            { "name": "giveup",      "anim": "Retry Loop",      "animHold": null, 			"model": "bfPixelsDEAD.xml" }
		]
    }
}

