{
    "model": "bfCar.xml",
    "healthbarColor": "0x31B3D1",
    "healthIconsModel": "/assets/common/image/funkin/icon-bf.xml",
    
	"alignVertical": "end",
    "alignHorizontal": "start",
    "leftFacing": true,

    "actions": {

        "sing": [
            { "direction": "left",   "anim": "BF NOTE LEFT"  },
            { "direction": "down",   "anim": "BF NOTE DOWN"  },
            { "direction": "up",     "anim": "BF NOTE UP"    },
            { "direction": "right",  "anim": "BF NOTE RIGHT" }
        ],

        "miss": [
            { "direction": "left",   "anim": "BF NOTE LEFT MISS"    },
            { "direction": "down",   "anim": "BF NOTE DOWN MISS"    },
            { "direction": "up",     "anim": "BF NOTE UP MISS"      },
            { "direction": "right",  "anim": "BF NOTE RIGHT MISS"   }
        ],

        "idle": { "animHold": "BF idle dance" },
		
		"extras": [
            { "name": "dies",        "anim": "BF dies",         "animHold": "BF Dead Loop", "model": "/assets/common/image/funkin/BOYFRIEND.xml" },
            { "name": "retry",       "anim": "BF Dead confirm",                             "model": "/assets/common/image/funkin/BOYFRIEND.xml" }
		]
    }
}

